numero_de_trabajador,distrito,registro_patronal,nss,curp,rfc,telefono,profesion,no_cedula,nivel,tipo_de_contrato,ultimo_contrato_vence,tipo_sangre,Género,domicilio,estado_civil,fecha_planta_anterior,fecha_planta,fecha_ingreso,puesto
50,PLANTA VERACRUZ,F5453150106,65108308472,MARG830830HVZLVL05,MARG8308305N6,NR,PREPARATORIA,NR,5,PLANTA,30/11/2022,A+,MASCULINO ,"Virgilio Uribe Junto a la Cancha, Los Idolos",CASADO ,01/06/2014,13/11/2017,13/11/2017,CABO DE SOLDADURA
56,PLANTA VERACRUZ,F5453150106,9988181294,MORG810110HTSRMN08,MORG810110RK7,NR,BOLETA SECUNDARIA,NR,5,PLANTA,30/11/2022,NR,MASCULINO ,"Leona Vicario S/N Iglesia, Rinconada, Emiliano Zapata",SOLTERO ,01/03/2014,13/11/2017,13/11/2017,TECNICO DE PAILERIA
68,PLANTA VERACRUZ,F5453150106,65058402663,REGA840417HVZYMB09,REGA840417D20,NR,BACHILLERATO,NR,5,PLANTA,30/09/2022,NR,MASCULINO ,"AV. Luis Donado Colosio No. 6 Col Centro, San Andres Tlalnehuayocan",CASADO ,01/07/2014,13/11/2017,13/11/2017,CABO DE ARMADO 
40,PLANTA VERACRUZ,F5453150106,65037815712,HEMM781122HVZRRG05,HEMM781122ME8,NR,NR,NR,5,PLANTA,01/01/6001,NR,MASCULINO ,"Calle Miguel Aleman S/N, Rinconada",CASADO ,11/10/2011,20/11/2017,09/11/2017,CABO DE SAND BLAST
70,PLANTA VERACRUZ,F5453150106,20917506436,BABC740808HVZRTR06,BABC740808BL5,NR,SECUNDARIA,NR,5,PLANTA,30/11/2022,NR,MASCULINO ,"Javier Mina No. 26 Palma de Abajo, Actopan",SOLTERO ,01/12/2012,09/11/2017,20/11/2017,TECNICO DE SAND BLAST
,,,,,,,,,,,,,,,,,,,
,,,,,,,,,,,,,,,,,,,
,,,,,,,,,,,,,,,,,,,
